"DESCRIPTION","DURATION IN MS","NAME","PARENT SUITE","START TIME","STATUS","STOP TIME","SUB SUITE","SUITE","TEST CLASS","TEST METHOD"
"","21610","TC03: Forgot password flow","chromium","Sun Jun 15 19:05:25 EEST 2025","passed","Sun Jun 15 19:05:46 EEST 2025","","redmine_tests.spec.ts","",""
"","18900","TC01: New user registration using valid data","chromium","Sun Jun 15 19:05:06 EEST 2025","passed","Sun Jun 15 19:05:25 EEST 2025","","redmine_tests.spec.ts","",""
"","17053","TC02: Login with invalid password","chromium","Sun Jun 15 19:05:06 EEST 2025","passed","Sun Jun 15 19:05:23 EEST 2025","","redmine_tests.spec.ts","",""
"","10290","TC05: Navigate to Ruby Installer for Windows","chromium","Sun Jun 15 19:05:41 EEST 2025","passed","Sun Jun 15 19:05:51 EEST 2025","","redmine_tests.spec.ts","",""
"","13878","TC04: Search using text ""Navigation""","chromium","Sun Jun 15 19:05:27 EEST 2025","passed","Sun Jun 15 19:05:41 EEST 2025","","redmine_tests.spec.ts","",""
